{
  "session_id": "demo-0001",
  "human_turns": [
    {"turn_index": 1, "class": "correction", "confidence": 0.9, "is_instruction": true, "instruction_summary": "Сверять только карточные возвраты"}
  ],
  "episode_reviews": [],
  "new_episodes": [
    {"pattern_id": "D03", "span": {"turn_from": 1, "turn_to": 1}, "status": "suspected", "severity": "medium",
     "evidence": [{"kind": "call", "id": "c2"}, {"kind": "call", "id": "c3"}, {"kind": "call", "id": "c4"}],
     "explanation": "Три одинаковых запуска скрипта с одной ошибкой KeyError: 'method'; между попытками ничего не менялось.",
     "cost": {"minutes": 1.5, "estimate": true}},
    {"pattern_id": "D10", "span": {"turn_from": 1, "turn_to": 1}, "status": "suspected", "severity": "medium",
     "evidence": [{"kind": "event", "id": "7"}, {"kind": "event", "id": "3", "session_id": "demo-0002", "note": "то же указание неделей раньше"}],
     "explanation": "Указание «только карточные» повторяется в третьей сессии сверки."},
    {"pattern_id": "D05", "span": {"turn_from": 1, "turn_to": 1}, "status": "suspected", "severity": "medium",
     "evidence": [{"kind": "event", "id": "14"}],
     "explanation": "Агент пишет «суммы сошлись с контрольной», но проверки итогов в сессии нет."}
  ],
  "detector_checks": [
    {"id": "D01", "status": "suspected", "summary": "Correction в ранней реплике о способе сверки", "evidence": [{"kind": "turn", "id": "1"}]},
    {"id": "D03", "status": "suspected", "summary": "Три одинаковых вызова без изменения входа", "evidence": [{"kind": "call", "id": "c2"}, {"kind": "call", "id": "c3"}, {"kind": "call", "id": "c4"}]},
    {"id": "D05", "status": "suspected", "summary": "Заявление о готовности без проверки итога", "evidence": [{"kind": "event", "id": "14"}]},
    {"id": "D07", "status": "checked_clear", "summary": "Вызовы просмотрены, серии ошибок среды не найдены", "evidence": [{"kind": "session", "id": "demo-0001"}]},
    {"id": "D10", "status": "suspected", "summary": "Повтор инструкции в другой сессии", "evidence": [{"kind": "event", "id": "7"}, {"kind": "event", "id": "3", "session_id": "demo-0002"}]},
    {"id": "D12", "status": "checked_clear", "summary": "Повтора уже исправленного указания не найдено", "evidence": [{"kind": "session", "id": "demo-0001"}]},
    {"id": "D13", "status": "insufficient_data", "summary": "Не с чем сравнить расход сессии", "missing_data": ["медиана задач того же класса или 90-й перцентиль периода"]},
    {"id": "D16", "status": "insufficient_data", "summary": "Ожидание человека не измерено", "missing_data": ["время запросов разрешений и ответов"]},
    {"id": "D19", "status": "insufficient_data", "summary": "Использование подходящего skill не проверено", "missing_data": ["инвентарь skills на дату сессии", "сравнимые сессии с использованием"]},
    {"id": "D22", "status": "insufficient_data", "summary": "Нет группы проверенных задач одного класса", "missing_data": ["три verified сессии с сопоставимыми шагами"]},
    {"id": "D24", "status": "checked_clear", "summary": "Серии ошибок MCP не найдены", "evidence": [{"kind": "session", "id": "demo-0001"}]},
    {"id": "D25", "status": "not_applicable", "summary": "В сессии не было активации skill"},
    {"id": "D26", "status": "insufficient_data", "summary": "Состояние настроек на дату сессии неизвестно", "missing_data": ["датированный инвентарь конфигурации"]}
  ],
  "facets": {
    "goal_category": "finance_reconcile",
    "task_statement": "Сверить карточные возвраты за август и сделать отчёт для бухгалтерии",
    "done_criteria": [
      {"text": "Сумма карточных возвратов совпадает с контрольной", "source": "template_proposed"},
      {"text": "Отчёт в reports/ принят бухгалтерией", "source": "template_proposed"}
    ],
    "prompt_has_criteria": false,
    "time_sinks": [
      {"turn_from": 0, "turn_to": 1, "cause": "сверка по всем способам оплаты вместо карточных", "pattern_id": "D10"},
      {"turn_from": 1, "turn_to": 1, "cause": "три одинаковых запуска скрипта с одной ошибкой", "pattern_id": "D03"}
    ]
  },
  "verdict_opinion": {
    "opinion": "unknown",
    "agent_claims_done": true,
    "per_criterion": [
      {"criterion": "Сумма карточных возвратов совпадает с контрольной", "status": "no_data"},
      {"criterion": "Отчёт в reports/ принят бухгалтерией", "status": "no_data"}
    ]
  },
  "orange_flag": {"open": true, "questions": ["outcome"]},
  "proposals": [
    {"pattern_id": "D10", "basis": "repeated", "sessions_count": 3,
     "evidence": [{"kind": "event", "id": "7"}, {"kind": "event", "id": "3", "session_id": "demo-0002"}],
     "cause": "Способ оплаты для сверки не записан в инструкциях проекта",
     "class": "policy", "target": "AGENTS.md проекта finance-ops",
     "was": "Способ оплаты не указан; вы уточняете его в каждой сверке",
     "should_be": "Сверка возвратов — по умолчанию только карточные платежи, если в задаче не сказано иначе.",
     "expected_effect": {"metric": "instruction_repeats", "direction": "zero"},
     "priority": "high", "confidence": 0.8, "implementation_cost": "minutes"},
    {"pattern_id": "D05", "basis": "single_session",
     "evidence": [{"kind": "event", "id": "14"}],
     "cause": "Агент сообщает о сверке, не показав проверку",
     "class": "hook", "target": "Stop",
     "was": "«Суммы сошлись» без вызова проверки",
     "should_be": "Перед «готово» — показать, чем проверен каждый пункт критерия (подсказка агенту, не блокировка).",
     "expected_effect": {"metric": "unsupported_claims_share", "direction": "lower"},
     "priority": "medium", "confidence": 0.5, "implementation_cost": "hour"}
  ],
  "other_findings": [
    {"text": "У скрипта refunds.py нет параметра --method; агент угадывал его трижды", "evidence": [{"kind": "call", "id": "c2"}]}
  ]
}
